{
  "schema": "pdgsolve-pdgedit-package/v1",
  "sourceAcceptanceDigest": "pdgsolve_problem_free_neutron_beta_exact::family.beta.exact.v1::v1",
  "publicationMode": "durable",
  "documentId": "pdgsolve_problem_free_neutron_beta_exact--family.beta.exact.v1",
  "documentTitle": "Free neutron beta exact",
  "pdgeditDocument": {
    "schema": "pdgedit/v1",
    "assemblies": [
      {
        "id": "unit_lane1_neutron.row.1",
        "type": "pro-neutron-assembly",
        "x": 2,
        "y": 0,
        "title": "Neutron Row 1",
        "role": "reactant",
        "tiles": [
          "pro-down-quark",
          "binary-full-br-br",
          "binary-full-br-bb",
          "binary-full-br-br"
        ]
      },
      {
        "id": "unit_lane1_neutron.row.2",
        "type": "pro-neutron-assembly",
        "x": 2,
        "y": 1,
        "title": "Neutron Row 2",
        "role": "reactant",
        "tiles": [
          "pro-up-quark",
          "binary-full-br-rr",
          "binary-full-br-br",
          "binary-full-br-rr"
        ]
      },
      {
        "id": "unit_lane1_neutron.row.3",
        "type": "pro-neutron-assembly",
        "x": 2,
        "y": 2,
        "title": "Neutron Row 3",
        "role": "reactant",
        "tiles": [
          "pro-down-quark",
          "binary-full-br-br",
          "binary-full-br-bb",
          "binary-full-br-br"
        ]
      },
      {
        "id": "unit_lane3_proton.row.1",
        "type": "pro-proton-assembly",
        "x": 9,
        "y": 0,
        "title": "Proton Row 1",
        "role": "intermediate",
        "tiles": [
          "pro-up-quark",
          "binary-full-br-rr",
          "binary-full-br-br",
          "binary-full-br-rr"
        ]
      },
      {
        "id": "unit_lane3_proton.row.2",
        "type": "pro-proton-assembly",
        "x": 9,
        "y": 1,
        "title": "Proton Row 2",
        "role": "intermediate",
        "tiles": [
          "pro-down-quark",
          "binary-full-br-br",
          "binary-full-br-bb",
          "binary-full-br-br"
        ]
      },
      {
        "id": "unit_lane3_proton.row.3",
        "type": "pro-proton-assembly",
        "x": 9,
        "y": 2,
        "title": "Proton Row 3",
        "role": "intermediate",
        "tiles": [
          "pro-up-quark",
          "binary-full-br-rr",
          "binary-full-br-br",
          "binary-full-br-rr"
        ]
      },
      {
        "id": "unit_lane3_electron.row.1",
        "type": "pro-electron-assembly",
        "x": 9,
        "y": 3,
        "title": "Pro Electron",
        "role": "intermediate",
        "tiles": [
          "pro-electron",
          "binary-full-br-bb",
          "binary-full-br-bb",
          "binary-full-br-bb"
        ]
      },
      {
        "id": "unit_lane3_electron_antineutrino.row.1",
        "type": "anti-electron-neutrino-assembly",
        "x": 9,
        "y": 4,
        "title": "Anti Electron Neutrino",
        "role": "intermediate",
        "tiles": [
          "anti-electron-neutrino",
          "binary-full-rb-rb",
          "binary-full-rb-rb",
          "binary-full-rb-rb"
        ]
      },
      {
        "id": "unit_lane5_proton.row.1",
        "type": "pro-proton-assembly",
        "x": 16,
        "y": 0,
        "title": "Proton Row 1",
        "role": "product",
        "tiles": [
          "pro-up-quark",
          "binary-full-br-rr",
          "binary-full-br-br",
          "binary-full-br-rr"
        ]
      },
      {
        "id": "unit_lane5_proton.row.2",
        "type": "pro-proton-assembly",
        "x": 16,
        "y": 1,
        "title": "Proton Row 2",
        "role": "product",
        "tiles": [
          "pro-down-quark",
          "binary-full-br-br",
          "binary-full-br-bb",
          "binary-full-br-br"
        ]
      },
      {
        "id": "unit_lane5_proton.row.3",
        "type": "pro-proton-assembly",
        "x": 16,
        "y": 2,
        "title": "Proton Row 3",
        "role": "product",
        "tiles": [
          "pro-up-quark",
          "binary-full-br-rr",
          "binary-full-br-br",
          "binary-full-br-rr"
        ]
      },
      {
        "id": "unit_lane5_electron.row.1",
        "type": "pro-electron-assembly",
        "x": 16,
        "y": 3,
        "title": "Pro Electron",
        "role": "product",
        "tiles": [
          "pro-electron",
          "binary-full-br-bb",
          "binary-full-br-bb",
          "binary-full-br-bb"
        ]
      },
      {
        "id": "unit_lane5_electron_antineutrino.row.1",
        "type": "anti-electron-neutrino-assembly",
        "x": 16,
        "y": 4,
        "title": "Anti Electron Neutrino",
        "role": "product",
        "tiles": [
          "anti-electron-neutrino",
          "binary-full-rb-rb",
          "binary-full-rb-rb",
          "binary-full-rb-rb"
        ]
      }
    ],
    "operators": [
      {
        "id": "unit_lane2_beta_dissociate",
        "type": "dissociate",
        "x": 7,
        "y": 2,
        "title": "Dissociate",
        "positrinoCount": 6,
        "electrinoCount": 6
      },
      {
        "id": "unit_lane4_pass_thru_proton",
        "type": "pass-thru",
        "x": 14,
        "y": 1,
        "title": "Pass Thru",
        "positrinoCount": 21,
        "electrinoCount": 15
      },
      {
        "id": "unit_lane4_pass_thru_electron",
        "type": "pass-thru",
        "x": 14,
        "y": 3,
        "title": "Pass Thru",
        "positrinoCount": 3,
        "electrinoCount": 9
      },
      {
        "id": "unit_lane4_pass_thru_electron_antineutrino",
        "type": "pass-thru",
        "x": 14,
        "y": 4,
        "title": "Pass Thru",
        "positrinoCount": 6,
        "electrinoCount": 6
      }
    ],
    "links": [
      {
        "id": "edge_neutron_to_beta_dissociate",
        "endpointA": "unit_lane1_neutron.row.3",
        "endpointB": "unit_lane2_beta_dissociate"
      },
      {
        "id": "edge_beta_dissociate_to_proton",
        "endpointA": "unit_lane2_beta_dissociate",
        "endpointB": "unit_lane3_proton.row.3"
      },
      {
        "id": "edge_beta_dissociate_to_electron",
        "endpointA": "unit_lane2_beta_dissociate",
        "endpointB": "unit_lane3_electron.row.1"
      },
      {
        "id": "edge_beta_dissociate_to_electron_antineutrino",
        "endpointA": "unit_lane2_beta_dissociate",
        "endpointB": "unit_lane3_electron_antineutrino.row.1"
      },
      {
        "id": "edge_lane3_proton_to_lane4_pass_thru.link.1",
        "endpointA": "unit_lane3_proton.row.1",
        "endpointB": "unit_lane4_pass_thru_proton"
      },
      {
        "id": "edge_lane3_proton_to_lane4_pass_thru.link.2",
        "endpointA": "unit_lane3_proton.row.2",
        "endpointB": "unit_lane4_pass_thru_proton"
      },
      {
        "id": "edge_lane3_proton_to_lane4_pass_thru.link.3",
        "endpointA": "unit_lane3_proton.row.3",
        "endpointB": "unit_lane4_pass_thru_proton"
      },
      {
        "id": "edge_lane4_pass_thru_to_lane5_proton.link.1",
        "endpointA": "unit_lane4_pass_thru_proton",
        "endpointB": "unit_lane5_proton.row.1"
      },
      {
        "id": "edge_lane4_pass_thru_to_lane5_proton.link.2",
        "endpointA": "unit_lane4_pass_thru_proton",
        "endpointB": "unit_lane5_proton.row.2"
      },
      {
        "id": "edge_lane4_pass_thru_to_lane5_proton.link.3",
        "endpointA": "unit_lane4_pass_thru_proton",
        "endpointB": "unit_lane5_proton.row.3"
      },
      {
        "id": "edge_lane3_electron_to_lane4_pass_thru",
        "endpointA": "unit_lane3_electron.row.1",
        "endpointB": "unit_lane4_pass_thru_electron"
      },
      {
        "id": "edge_lane4_pass_thru_to_lane5_electron",
        "endpointA": "unit_lane4_pass_thru_electron",
        "endpointB": "unit_lane5_electron.row.1"
      },
      {
        "id": "edge_lane3_electron_antineutrino_to_lane4_pass_thru",
        "endpointA": "unit_lane3_electron_antineutrino.row.1",
        "endpointB": "unit_lane4_pass_thru_electron_antineutrino"
      },
      {
        "id": "edge_lane4_pass_thru_to_lane5_electron_antineutrino",
        "endpointA": "unit_lane4_pass_thru_electron_antineutrino",
        "endpointB": "unit_lane5_electron_antineutrino.row.1"
      }
    ],
    "compositeLabels": []
  },
  "manifestEntry": {
    "id": "pdgsolve_problem_free_neutron_beta_exact--family.beta.exact.v1",
    "title": "Free neutron beta exact",
    "displayTitle": "Free neutron beta exact",
    "documentPath": "content/contracts/examples/pdgedit/pdgsolve_free_neutron_beta_exact.v1.json"
  }
}
